Skip,Complete?,Story Relevant,Scan Level Needed,Anomaly Level,Location,Planet wanted,Habitable Planet,Asteroids,Nebula,Name,Narrative Seed,Reward,Notes,Comments,Zabanian,Sedranian,Wombles,Fongari,Haxan,Ratfolk
,,,2,15,AAB,Y,Desolate,,,"Ancient Zabanian Empire Outpost on planet
modern Zabanian outpost in space","Tentative indications have been found of ruins of an ancient civilisation.  Speculation is running rampant as to who they might be, and what happened to them.  Orbital scans are only so good though, a proper archaeological dig is called for!

Zabanian robots were programmed to attack Zabanians - this colony was eliminated by Zabanian Empire because it was infected by Fongari/Ungaree",Combat with L3 Army,"Requires ground examination, two spawns",,"Tentative indications have been found of ruins of an ancient civilisation on a desolate world. Speculation is running rampant among the crew as to who they might be, and what happened to them. Orbital scans are only so good though, a proper archaeological dig is called for! (level 15 anomaly)",,,,,
,,,,,ABC,,Desert,Yes,Yes,adianite on planet,The desert world in this sector contains a deposit of the rare mineral adianite,Resource to be harvested,,,,,,,,
,,,1,5,ACE,,"Temperate, Molten?",,,Russell's Teapot/Kallipolissian Urn,"One of the most odd discoveries made in recent times - there appears to be a ceramic object in orbit of a planet in this system.  Clearly placed far enough out to ensure that it remains in a stable orbit, this object warrants further investigation as it has  been in orbit for some time and placed there for some reason.",Gain 2 Xenology Science Points,,Why not  a basic skill in philosophy...,,,,,,"Although the ship’s sensors are pretty basic, a sharp-eyed rat notices an oddity - there appears to be a small ceramic object in orbit of a temperate planet in this system. Clearly placed far enough out to ensure that it remains in a stable orbit, this object warrants further investigation as it has been in orbit for some time and must have been placed there for some reason."
y,,,1,,BBC,,Temperate,,,Zabanian homeworld ,"Zabania - Temperate. Minerals 10

Thirty-two scattered cities dot the vast, untamed landscape. The cities are heavily defended, heavy weaponry mounted atop their great walls. The land for a few miles around each city has been cleared into a killing field, and scorch marks are visible on the ground from where the city guns have struck.  It isn’t clear at first glance what threat the weapons were designed to defend against, but whatever it is the inhabitants clearly take them seriously.  Low-orbit shuttles travel regularly between the cities.
In addition to the relatively few cities scattered on the planet's surface, there are a number of much smaller townships, around 300 in total.  These also have ""killing fields"" around them, however these are much smaller.  

Outpost - Zabanain Remnant                                  ",,,,,,,,,
y,,,,,BCD,,,,Yes,,,,,,,,,,,
ss,,,0,,BDF,,,Yes,,,Space sharks,,,,,Missed,,,,Missed
,,,3,60,CCD,Y,Desolate,Yes,,Orion Military Base/Zabanian world,"There are some ancient ruins on a planet in this system, but this isn't what has the archaeologists interested - the ruins have been partially destroyed by a large impact.  It appears to be orbital bombardment of some kind, but only a full ground investigation will reveal all the secrets.  The archaeology team isn't packing light, they plan to be there a while.",,,,,Missed,PARTIAL - The crew notice a desolate planet that has been partly destroyed by a large impact.(It’s possible to colonise desolate worlds),,,
ss,,,,0,CCD,,,,,,Space sharks,,,,,,,,,
ss,,,,0,CDE,,,,,,Space sharks,,,,,,,,,
y,,,,,CEG,,Temperate,Yes,,Outpost Arachni,Outpost Arachni.  Asteroid Mine Arachni.,,,,,It fails to find anything unusual apart from an outpost owned by Arachni and an asteroid mine also owned by Arachni.,,,,Travelled
y,,,,,DDE,,Temperate,,,Wimbledon Common,"Wimbledon Common. Temperate, Minerals 10.
This is the homeworld of the Wombles.
The planet is mostly covered by a giant ocean with many small islands.  There is one large crescent-shaped continent which is mostly in the southern hemisphere but with one horn extending across the equator.  The vegetation is mostly low lying but with clumps of taller plants.  Rolling across the plains are, what appear to be, numerous species of tumbleweed. The settlements have few above ground buildings but sensors reveal that there are numerous tunnels below ground around the buildings.  One exception is a settlement around what appears to be a giant grounded starship where above ground buildings are the norm although tunnels are still present.  The inhabitants appear to travel between distant settlements by means of catapult launched gliders.

Clapham Common. Desert  Minerals 10
This world has been colonised by the Wombles.
This world is a tidally locked moon of the system's largest gas giant.
The side facing away from the gas giant appears to be barren, cracked rock.  The side facing the gas-giant has a tenacious ring of foliage.
The sole apparent source of water for this foliage is the geysers that cover the surface of the planet.

Outpost Wombles",,,,,,,,,
ss,,,,,DDE,,,,,Space Sharks,Space sharks arrive in turn 9,,,,,,,,,
,,,3,60,DEF,Y,Temperate,,,Crash Landed Zabanian Colony Ship,"There are some ancient ruins on a planet in this system, but this isn't what has the archaeologists interested - the ruins have been partially destroyed by a large impact.  It appears to be orbital bombardment of some kind, but only a full ground investigation will reveal all the secrets.  The archaeology team isn't packing light, they plan to be there a while.",Gain 50 Xenology Science Points,"Zabanian world which was launching a colony ship, which failed, crashlanding on its own planet.",,"Partial - Utasso the Scented finds nothing of any interest.  There are ancient ruins here, but they’ve mostly been destroyed by a large impact.",,,,,
y,,,,,DEF,,Temperate,NO,,Asterioid Mine arachni,"Asteroid mine Arachni.
",,,,,,,,,
,,,0,8,DFH,,,,,Black Hole,"Outpost Arachni.  Asteroid mine, Arachni.
Very little of this star system remains.  No doubt it contained something of value in the distant past.  All that remains are a few eccentrically orbiting rocks and a black hole.  Perhaps something useful can be gained from studying the black hole?",Completion of the anomaly permits the construction of a scientific outpost to study the black hole.  This will provide 2 Physics Science Points per turn.,Entire System,Small ones are lethal.  Very large ones paradoxicly are safer.,,Very little of this star system remains. No doubt it contained something of value in the distant past. All that remains are a few eccentrically orbiting rocks and a black hole. Perhaps something useful can be gained from studying the black hole?,,,,"Very little of this star system remains. No doubt it contained something of value in the distant past, but all that remains now are a few eccentrically orbiting rocks and a black hole. Perhaps something useful can be gained from studying the black hole?"
,,,2,,EEF,,Temperate,,Yes,Debris Cloud (Betelguese),"Unusual debris patterns are found across this nebula.  The physics holding these in place must be operating on totally different principles to those outside this nebula.  Either that, or the conditions here are unique, permitting some truly astounding insights.",Ambush by L3 Betelguese Fleet, Gate piece,,,,,,,
ss,,,0,,EFG,,Temperate,,,,Space Sharks,,,,,,,Space sharks,,
,,,3,35,EGI,desolate,Desolate,,,Rigel,"The habitable planet in this system has an extremely odd density.  It is substantially less dense than one would expect of a typical rocky world.  Either this particular planet has not formed in the standard way expected of such planets or at some point in the past an extensive mining operation took place.  It isn't possible to determine which may be the case from orbital scans; if mines were present here, it was so long ago that they have collapsed.",AI tech,,,,,Missed,,,Missed
y,,,,,FFG,,,Yes,Yes,Arachni asteroid mine,Arachni asteroid mine. Hesperos - L2 female.,,,,,,,,,
y,,,,,FGH,,,Yes,,,,,,,,,,,,
y,,,,,GHI,,Molten?,Yes,,Male spider,"
A gigantic spider occupies an asteroid belt in this system.",,,,,,,,,
,,,2,8,GIK,N,,Yes,,Ungaree Pirate Outpost,"It would appear that some ancient civilisation once claimed this system, as an abandoned outpost is near one of the uninhabitable worlds in this system.  It might contain something useful?",Ambush by L1 Pirate Ship,"Several, may turn up in later turns",,,,Missed,"It would appear that some ancient civilisation once claimed this system, as an abandoned outpost is near one of the uninhabitable worlds in this system.  It might contain something useful?",Missed,Missed
y,,,,,HII,,"Temperate,Desert",Yes,,Fongari homeworld,"Onkodis. Temperate. Minerals 10

Fongari homeworld

Clangers. Fongari Colony world Desert Minerals 10

Outpost - Fongari",,,,,,,,,
ss,,,0,,HIJ,,Desolate,,,,Space Sharks,,,,,,,Missed,,
,,,1,6,HJL,,Desolate,Yes,,"""Elephant's Graveyard""","Dying race hoarding relics of ancestors.
Eyes are immediately drawn to a large obelisk on the surface of a desolate world, in the middle of a large desert.  How it was constructed - and why - is a matter of great debate.  Debate which is ended with a shrug of “who cares why - is there anything valuable down there?!”

Initial scans show that the planet has life barely clinging on through the awful conditions. Whatever is down there can’t possibly be guarded well. It might take some time to explore thoroughly (or carry everything back to the ship).  Of course, there might be nothing at all, but those natives must have something….
Anomaly Level 6

This may relate to the original native race on Sanara.  ","Lots of stealable materials, prob Adianite",,,,,,,,"Eyes are immediately drawn to a large obelisk on the surface of a desolate world, in the middle of a large desert. How it was constructed - and why - is a matter of great debate. Debate which is ended with a shrug of “who cares why - is there anything valuable down there?!”

Initial scans show that the planet has life barely clinging on through the awful conditions. Whatever is down there can’t possibly be guarded well. It might take some time to explore thoroughly (or carry everything back to the ship). Of course, there might be nothing at all, but those natives must have something…."
y,,,,,HJL,,Desolate,Yes,,Outpost Arachni,"Outpost Arachni.  Asteroid mine, Arachni.
",,,,,,,,,
,,,1,12,IJJ,,,,,Rive Crystals,"Stunningly beautiful crystalline structures are found throughout the system.  These structures, no greater than a metre or two across, actually have the ability to move.  The first time a crystal moved it was something of a shock, but they definitely appear to be alive, at least to some degree.  Life really is strange out here.",Adianite,,,,,,"Stunningly beautiful crystalline structures are found throughout the system. These structures, no greater than a metre or two across, actually have the ability to move. The first time a crystal moved it was something of a shock, but they definitely appear to be alive, at least to some degree. Life really is strange out here.",,
,,,2,15,IJK,,Desolate,,,Archaeological Expedition [Zabanaian Empire],"Tentative indications have been found of ruins of an ancient civilisation.  Speculation is running rampant as to who they might be, and what happened to them.  Orbital scans are only so good though, a proper archaeological dig is called for!",Gain 10 Xenology Science Points,"Requires ground examination, two spawns",,,,,,,Missed
y,,,,,IKM,,Desolate,Yes,,Foliá Aráchnis,"Foliá Aráchnis
Outpost Arachni.  Asteroid mine Arachni

This sector has an unusually large number of stargates, fourteen in all, entering the sector from every direction.  Between them, anchored to the gates running up, down and sideways runs a massive web structures, carefully placed to avoid blocking any of the gates.  Tiny lights blnk along the outer edges of the webs - without the lights, some of the webs are so fine that you might have flown into them before you spotted them.

In the centre of the largest web sits a giant spider.  Gawping at her, you conclude she is easily the size of a battleship.",,,,,,,,,
,,,1,3,JKK,Y,Arctic,Yes,,Orion Network Troop Transport,There appears to be a substantial cloud of debris in orbit around one of the planets in this system.  One of the survey crew suggests taking a closer look to see if there's anything worth salvaging.,,Several, salvage equipment required,,,,,"There appears to be a substantial cloud of debris in orbit around one of the planets in this system.  One of the survey crew suggests taking a closer look to see if there's anything worth salvaging. 
A second points out that Discovery I doesn’t have salvage equipment that would be substantial enough to get anything useful.",
,,,1,2,JKL,,,Yes,,Unusual Asteroid,"A particularly attentive survey assistant noticed an unusually dense comet whilst scanning the system.  Upon further examination a seam of precious metals is detected, which could be easily mined…",Gain 20 credits/adianite,No prerequisite technologies required, Several,Several' what?,"There are no planets of any interest here, but a particularly attentive survey assistant noticed an unusually dense comet whilst scanning the system. Upon further examination a seam of precious metals is detected, which could be easily mined…",,,,
,,,,,JKL,,,,,Zabanian Remnant System,Outpost,,,,,,,,,
y,,,,,KLL,,Dyson Sphere,,,Homeworld Haxan Independents,"Homeworld Haxan Independents

Outpost Haxan Independents.",,,,,,,,,
,,,1,3,KLM,,Temperate,,,Debris Cloud (Minor),There appears to be a substantial cloud of debris in orbit around one of the planets in this system.  One of the survey crew suggests taking a closer look to see if there's anything worth salvaging.,Gain 0-2 Physics or Engineering science points,Several, salvage equipment required,I asume it turned out to be the remains of a ship?  I only guess this because of the need for salvage gear....,,,,There appears to be a substantial cloud of debris in orbit around one of the planets in this system. One of the survey crew suggests taking a closer look to see if there's anything worth salvaging.,
,,,,,KLM,,Temperate,,,sapient crabs,"Pre ftl  - theocracy  Jaden

Opponents -Giant Crabs
2xL2 Armies - Base 10 Health, Doubled as crab racial trait. 12 modules, 4 offensive, 8 defensive
=>8 Infantry Level 2 Defence = 260 health=> 4 Close Assault Weapons = 16 firepower (32 against militia)

Total Damage to Crabs = 16+18=34 Damage to 1 Army",,"Crabs may have been space-faring at one point. It would explain all the red jump routes.

A decent survey might find evidence.",,,,,,,
y,,,,,LMM,,Temperate,,,https://archiveofourown.org/works/35797606,"Kallipolis. Temperate. MInerals 10
This is the homeworld of the Kallipoli centaurs.

Kallipolis has wide open grasslands with occasional small forests.  Cities are small and very open plan. It's clear that the inhabitatnts spend most of their time outdoors.

There is a large range of volcanoes along the eastern side of the largest continent and eruptions are not uncommon, with the potential to cause large loss of life.

Fengári (arctic) Minerals 10

A cold, frozen moon, Colonised by the centaurs

Outpost Kallipolis",,,,,,,,,
,,,2,9,LMN,Y,Temperate,Yes,,Zabanian Empire Abandoned Army,An unusual metal signature has been detected on a planet in this system.  It may be worth exploring to see if it is worth establishing a mining operation.,Combat with L2 Zabanian army,Requires ground examination,,,,,,,Missed
,,,1,2,MNN,,,,,Abandoned Ship,,,,,,,,,,"The sensor rat shouts “Bingo! We finally found something in this useless wilderness.” She points to a splodge on the screen and enhances the magnification as far as she can. “I think it’s the remains of an old ship. Bound to be some loot there.” (Level 2 anomaly - needs two turns)

The urge to shout at the sensor rat suddenly dissipates. Maybe there might be value in better sensors after all…"
,,,,,MNO,,Temperate,,,colourful sapient parrots,engineers - artistic - demcratic - lots of squawking debates,,,,"There appears to be a fairly primitive, yet potentially sapient, species on the temperate world in this system. They haven’t reached spaceflight, and don’t seem to be even close to that just yet.  There appear to be elaborate structures at the tops of trees across significant proportions of the planet, indicating that they spend most of their lives in the trees rather on the ground.
A survey team on the ground might be able to make contact with this species, but no advanced communication methods have been detected to make contact from orbit.
Though technologically inferior, one or two of the geneticists are concerned at attempting to capture these creatures as they appear to live at the top of trees and fly frequently.  One of the security guild thinks that this shouldn’t be much of an issue, though this is a matter of great debate.",,,,,
,,,,,MNO,,,,,Zabanian Remnant System,Outpost,,,,,,,,,
ss,,,0,,NOO,,,,,,Space Sharks,,,,,,,,,Missed
,,,3,70,NOP,,,,,"""Rendevous with Rama""",Giant Cylinder moving through space slowly.  Built by humans.,,,,,,,Missed,,
y,,,,,OPP,,Temperate,Yes,,Ratfolk homeworld,"Sanara - Temperate.  Minerals 10.          
The Skylands - Inhospitable Minerals ?
From orbit, the small planet of Sanara looks like a cloudy ocean world with two distinct sandstone coloured poles, wrapped round with a dramatic ring interspersed with chunky moons.

Sanara
 It is close to the sun and has a high orbit speed giving short days and nights. Around the equator, massive spiral steam cloud-banks constantly shift and warp, like gigantic serpents circling the world, but they calm down and become smaller and gentler as the clouds reach the poles. Deep beneath the waves can be seen red glowing dots where the molten core of the world is exposed. 

The only visible landmasses are at the two poles of the planet, where the conditions are cooler and more comfortable for life. Each pole resembles a huge sandy coloured rock of land that are orbited by lots of smaller islands. There is little vegetation on the surface, but on each of the landmasses are thousands and thousands of small holes. If you were to zoom right in as far as you could, you'd be able to see that these holes are artificial, though not very neatly organised. Some are crude, but many are ornate openings that lead to cool underground cities and caves. At night, the holes would be lit up by a soft blue glow from the luminous fungi that grows underground.

Only one significant settlement appears to be visible from orbit on the northern landmass. It is a recent construction, but still looks like little more than strategically stacked junk and rocks. The specially flattened surfaces in the settlement appear to be the only viable places to land safely.

Outpost - Ratfolk

The Skylands - Arctic Minerals 10
The Skylands are settlements scattered among the rocks of Sanara's ring.  Small ships can be seen dodging in and out between the flying rocks that make this a dangerous region to live in.",,"Ships with <2 sublight engines CAN visit the Skylands, they just have a risk of collision. (GM rolls dice)",,,,,,,
,,,2,,OPQ,,,,,Desert World - Edranna,"Inhabited by pre-ftl culture. Level of development is around 18th century.  GM notes - this is the native planet of the Sedranians. There is a deposit of adianite here that the Zabanian Empire wanted and they removed most of the native population to enable themselves to mine it. The natives got 'restless' when the Zabanians started mining their world.  PR back home prevented them from wiping the people out, but they shipped all trouble makers to Scipio (RSS) where deprived of community and in a hostile climate, they made easy cheap labour.",,,,,,,,,Miss
,,,2,6,OPQ,,Desert,Yes,,Inert Zabanian Empire Shipwreck,"It has taken some time to pin down, but there's definitely a ship out there.  It doesn't appear to have any power signature at all, which made it challenging to locate.  The large mass was clearly a trade ship of some kind and has been substantially damaged as it is riddled with holes.  There doesn't appear to be much of the ship left, but maybe there's something of use left?",Gain 5 science points for ship construction,"Potentially have quite a few around, with larger ships towards the old homeworld and smaller ships further out.",,,,,,,Miss
y,,,,,OPQ,,Desert,Yes,,Male spider - Nicholas,Asteroid mine Arachni. A gigantic spider appears to be working among an asteroid belt in this system.,,,,,,,,,
y,,,,,PQQ,,,Yes,,Male spider Kallias,"Asteroid mine Arachni.
",,,,,,,,,
,,,2,8,PQR,Y,Arctic,Yes,,Abandoned Outpost,"It would appear that some ancient civilisation once claimed this system, as an abandoned outpost is near one of the worlds in this system.  It might contain something useful?",Gain 5 Xenology Science Points,Several,GENETIC STUDY: ZABANIAN COMPLETED - ABILITY TO COLONISE ARCTIC WORLDS WITHOUT HABITAT DOMES,"where they find what appears to be an ancient outpost which at some time signified ownership over the system. The initial scans are inconclusive, but upon closer examination the airlock controls seem familiar. Upon entry, what language remains after all this time is clearly Zabanian, or extremely close. This has to be one of the Zabanian Empire’s outposts! Who knows what valuable information may have remained?",,,,,
,,,,,PQR,,,,,Zabanian Remnant System,"Outpost in system, and planetary mining facility in place",,,,,,,,,
,,,2,50,QRR,,,Yes,,Sentient Gas Giant,"Star is due to supernova, it knows it has problems","Knows a lot, but very slow and difficult to communicate with",,needs 12 points of sublight engine to raise gate segment.,,,,,,
ss,,,0,,QRS,,,Yes,,,Space Sharks,,,,,,,Missed,,
,,,3,,RSS,,Temperate,Yes,,Gate segment,"Curently in the ocean, there is a strange object. Science espionage project might get more data.",needs 6 points of sublight engines to lift to orbit.,,,,,,,,
,,,,,RSS,,Temperate,Yes,,Sedrana homeworld,"Sedrana Artic Minerals 10

Homeworld of the Sedrana Ascendency

Scilitan Temperate Minerals 10
Settled by the Sedranan Ascendency",,,,,,,,,
y,,,,,RST,,,,Yes,,,,,,,,,,,
,,,2,15,STT,Y,Arctic,Yes,,Inert Zabanian Empire Outpost,"Tentative indications have been found of ruins of an ancient civilisation.  Speculation is running rampant as to who they might be, and what happened to them.  Orbital scans are only so good though, a proper archaeological dig is called for!",,"Requires ground examination, two spawns",What does 'Misogi techology unlock' actually mean?  A skill in robot engineering? Something else?,,Missed,Missed,,,
y,,,,,STT,,,,,Sedranian System,"Outpost, modern Sedrana colony",,,,,,,,,
y,,,,,STU,,,,,,,,,,,,,,,
,,,,,TUU,,Temperate,,,,,,,,,,,,,
,,,4,25,TUV,,Molten?,Yes,,Debris Cloud (Major),"Asteroid Mine, Arachni.  

A tremendous quantity of debris has collected at one of the planetary Lagrange points.  Whether a large battle took place nearby in the past or if this is a freak occurrence it isn't possible to tell from here.  It may be worth trawling through the larger pieces of debris as there may be something worth recovering.  It might take a while though.",Gain 20 Science Points (Unspecified),Salvage Equipment Required, Multiple?,Only L3/L4 Lagrange points are long term stable,,,,Missed,
,,,2,9,UVV,Y,Temperate,,,Mineral Deposit,An unusual metal signature has been detected on a planet in this system.  It may be worth exploring to see if it is worth establishing a mining operation.,,Requires ground examination,,,,"The science officer stares into his screen, trying to do his best with the limited resources at his disposal.  After spending a year investigating the system, he concludes there’s nothing to see. Then his assistant leans over his shoulder, wipes a fingerprint off the screen and points out a temperate planet with good mineral deposits!",,,
,,,4,25,UVW,,,Yes,Yes,"Debris Cloud (Orion, Major)",A tremendous quantity of debris has collected at one of the planetary Lagrange points.  Whether a large battle took place nearby in the past or if this is a freak occurrence it isn't possible to tell from here.  It may be worth trawling through the larger pieces of debris as there may be something worth recovering.  It might take a while though.,,Salvage Equipment Required, Multiple?  EGI target for them,,,,,,
,,,1,4,VWW,Y,Temperate,Yes,,Unstable Ungaree Shipwreck,"A power signature fluctuates wildly in the depths of space.  Located between the orbits of two planets, it is inexplicably in the middle of nowhere.  The signature is oscillating in a pattern which seems oddly familiar to the engineering crew, and they recommend moving quickly to investigate, but with caution.",Gain 5 science points for cargo space,Detonates three turns after discovery,Why cargo space?,,,"A power signature fluctuates wildly in the depths of space.  Located between the orbits of two planets, it is inexplicably in the middle of nowhere.  The signature is oscillating in a pattern which seems oddly familiar to the engineering crew, and they recommend moving quickly to investigate, but with caution.","A power signature fluctuates wildly in the depths of space.  Located between the orbits of two planets, it is inexplicably in the middle of nowhere.  The signature is oscillating in a pattern which seems oddly familiar to the engineering crew, and they recommend moving quickly to investigate, but with caution.",,
