Skip,Complete?,Story Relevant,Scan Level Needed,Anomaly Level,Location,Planet wanted,Habitable Planet,Asteroids,Nebula,Name,Narrative Seed,Reward,Notes,Comments,Zabanian,Sedranian,Wombles,Fongari,Haxan,Ratfolk
,,,1,2,VWX,asteroid belt,,Yes,,Space Maggots,There are a collection of creatures infesting an asteroid field in the system.  They are about half the size of a L1 ship and appear to be eating the rocks which are closest to them.  They do not seem to care that they are being scanned and would not seem to be hostile in any way.,"2 Adianite initially, one per turn (requires cargo)",,Harvested for what?  MIneral recovery? Food?,There are a collection of creatures infesting an asteroid field in the system.  They are about half the size of a L1 ship and appear to be eating the rocks which are closest to them.  They do not seem to care that they are being scanned and would not seem to be hostile in any way.,,"There are a collection of creatures infesting an asteroid field in the system. They are about half the size of a L1 ship and appear to be eating the rocks which are closest to them. They do not seem to care that they are being scanned and would not seem to be hostile in any way.
COMPLETE: The Space Maggots are thoroughly productive creatures, but they might be a touch boring (pun intended!).  They spend all their lives, or at least as long as they have been observed, consuming small parts of an asteroid.  Whilst initially fascinating as a new form of life, the maggots unfortunately don’t seem able to absorb complex forms of political thought, or indeed any thought at all.
In the interest of being thorough in their examination, a decision is agreed upon to examine one of the bodies of the maggots, to see if a dissection may reveal any further secrets.  This proves to be an excellent decision, another victory for collective decision making, when the digestive system of the maggot reveals a viable quantity of adianite. It seems that the maggot is unable to process this mineral, and so it has built up over time.  Perhaps it is in fact what killed it?  A quick scan of the nearby asteroid confirms that traces of adianite are present throughout, but it would take a very long time to manually acquire anything useful.",,,
y,,,4,35,WXX,,Temperate,Yes,,Ungaree Homeworld,"Studing your sensors, you see a temperate world that has clearly had a troubled past. Even after the passage of unknown years, there are still clear signs of what must once have been great cities.  Although there are many  native species here, they are primarily in the oceans.   Whales, fish and other sea creatures abound.  Land-based life is mostly confined to smaller forms, but perhaps there are larger creatures concealed in the vast forests.","Ambush by 5x L2 armies; Gate piece

needs 6 points of sublight engines to lift to orbit.",Could be ,,,,,"There is a temperate world here, but it’s been badly damaged and has no obvious sentient life. (see survey report lower down) It’s not currently habitable, though it could have been once.  It’s possible that with sufficient effort, the ecosystem could be restored and the planet made habitable again.",Missed,
,,,,,WXX,,Temperate,Yes,,Ancient Deep Space Sensor,"Your navigator points out a Deep Space Sensor, but it's no longer functional. A closer investigation suggests that it is of great age as it appears to to have suffered from severe metal fatigue. You are just able to make out a time-worn plaque on it saying: ""Installed by Kallipolis in compliance with the PeaceTreaty between the Zabanian Empire, the Ungaree and the Orion Network"".",,,,,,,,Yes,
y,,,,,WXX,,,,,Haxan Outpost,,,,,,,,,,
,,,,,WXY,,Temperate,Yes,,,"Asteroid Mine, Arachni. Currently occupied by a giant spider.",,,,,,,,,
,,,,,WXZ,,,,,,,,,,,,,,,
,,,4,80,XYY,Y,Temperate,Yes,,[Robot Stronghold],"A very weak signal is emanating from the asteroid field in system.  It seems to be partially shielded from sensors, some sort of leakage?  Though it is localised to the belt, narrowing it down further is likely to take some time.  Perhaps someone is hiding out there?  But if they are, maybe they don't want to be found?","If military ship present, pirate attack.  Can ignore civilian only ship (survey ship) unless a particularly valuable target or the survey ship has obviously located them.",,,,,,Miss,,Miss
y,,,,,XYZ,,,Yes,,Male Spider,"Asteroid mine Arachni.
",,Several,,,,,,,
,,,,,YZA,,Arctic,Yes,Yes,Mammoths,A military dictatorship of mammoths (nothing to do with Arachni),,,,,,,,,
,,,2,15,YZZ,,Desolate,Yes,,Cryosleep,"The desolate planet in this system is clearly suboptimal for organic life, but remains within necessary parameters for acquisition as a new node. Sensors do detect a weak source of power from a point underground. Analysis indicates that this source of power registers as weak due to substantial shielding, and is therefore intentional.

Examination of the surface of the planet reveals previous settlement by organic life. High probability that the artificial power source was intended for a purpose which extended beyond the functional lifespan of the species. This reduces the number of possibilities, but all include a well engineered power source which requires little maintenance.

The people who settled here briefly were Sedranians who fled from OPQ when the Zabanians took over. They stole a troop transport and fled and eventually landed here (crashing). But this world was desolate and they had no colonisation gear.  They gave up, headed into the deepest warmest caves they could find and took the cryo units from the troop ship with them.",,,,,,,,"The desolate planet in this system is clearly suboptimal for organic life, but remains within necessary parameters for acquisition as a new node. Sensors do detect a weak source of power from a point underground. Analysis indicates that this source of power registers as weak due to substantial shielding, and is therefore intentional.

Examination of the surface of the planet reveals previous settlement by organic life. High probability that the artificial power source was intended for a purpose which extended beyond the functional lifespan of the species. This reduces the number of possibilities, but all include a well engineered power source which requires little maintenance.

Anomaly level 15 - extensive examination of underground chambers is required (no further requirements beyond a ship with sensors is needed though).  Be advised that if the planet is used for a node, this anomaly will be destroyed.",
,,,3,40,ZAA,,,Yes,,Energy Bees,,Resource to be harvested,Gas Giants needed,,,,,,,Missed
,Kallipolis,,2,8,ZAB,,,,,Gelatinous cube,"There are certainly no habitable planets in this system, but it is equally certain that a form of life exists upon one of the rocky worlds in system.  The toxic atmosphere precludes it from breathing anything similar to ourselves.  The natural appearance for one of these lifeforms appears to be a roughly cuboid shape, translucent, and quite flexible.  That said, they appear to enjoy taking different shapes, and primitive buildings and even plantlife seems to be created by these objects as they combine where necessary to form larger objects. Quite what they are doing here is anyone’s guess, and there’s a firm debate about whether they are in fact alive.","4 Xenology SP, genetic information for Zabania",,,,,,,,
,,,4,,,,,,,Gate segment,Can't really investigate until you can work out how to get close to it...,,,Is this meant to be in QRR?,,,,,,
,,,,,,,,,,,,,,,,,,,,
,,,,,,,,,,,,,,,,,,,,
,,,,,,,,,,,,,,,,,,,,
,,"Note: ABC/RST/UVW remote location, nebula",,,,,,,,,,,,,,,,,,
,,,,,,,,,,pre-ftl monarchy,,,,,,,,,,
,,,,,,,,,,,,,can't be solved by more sensors,,,,,,,
,,,,,,,,,,old man with two AI dogs,,,,,,,,,,
,,,,,,,,,,,,,,,,,,,,
,,,,,,,,,,something needing ingenuity,,,,,,,,,,
,,,,,,,,,,"~4 other civilisations, pre FTL",,,,,,,,,,
